{"$schema":"../../spec/schemas/public-proof.schema.json","schema":"neosmartui/public-proof@1","component":"core.alert","deployedSource":{"repository":"neosmartui/neosmartui","sha":"20b32bba63f5882b17193eaca093e315c214ccd6"},"implementationFiles":[{"path":"packages/adapters/web/components/alert.css","blobSha":"8d4e4aafae799a347a4d02e19e8eadfe139ca979"}],"browserEvidence":{"runId":34721447129,"artifactId":10306147715},"deployment":{"repository":"neosmartui/neosmartui.github.io","commitSha":"06c68201a1842cdea42fa5e4d24c68215e97ae51","treeSha":"7ff00b76190cab5c9cdf1862db2cff4b0c7762d2","pagesRunId":34721869013},"live":{"pageUrl":"https://neosmartui.github.io/","deploymentRecordUrl":"https://neosmartui.github.io/deployment.json"}}
