{"$schema":"../../spec/schemas/public-proof.schema.json","schema":"neosmartui/public-proof@1","flavor":"flavor.hardline","deployedSource":{"repository":"neosmartui/neosmartui","sha":"75fe02594bf1395275f1b4c611bcb4b1d8b1999c"},"implementationFiles":[{"path":"packages/themes/hardline-light/theme.json","blobSha":"0debcfc19995e9343d82bef60c78f039f441860e"},{"path":"packages/themes/hardline-light/resolution.json","blobSha":"6074641914b936b431177c0865f5b2002d882b2b"},{"path":"packages/themes/hardline-light/tokens.json","blobSha":"6f4f4da18f662b6c0af9f9a7b66c7070717dec87"},{"path":"apps/foundry/src/flavors/hardline/index.html","blobSha":"e62450698fb966799c92236fbb5d616ea71aee2c"}],"browserEvidence":{"runId":34713187736,"artifactId":10304495336},"deployment":{"repository":"neosmartui/neosmartui.github.io","commitSha":"c493bb58fcae679c16bf374775be1523ed50a28c","treeSha":"6423aef0f9b9be2088812143925b4a97c852c101","pagesRunId":34713466334},"live":{"pageUrl":"https://neosmartui.github.io/flavors/hardline/","deploymentRecordUrl":"https://neosmartui.github.io/deployment.json","assetUrls":["https://neosmartui.github.io/hardline-theme.css"]}}
