{
  "$schema": "../../spec/schemas/public-proof.schema.json",
  "schema": "neosmartui/public-proof@1",
  "component": "core.checkbox",
  "deployedSource": {
    "repository": "neosmartui/neosmartui",
    "sha": "026250b5f2400777ef2701b80990b1e9d6d0b938"
  },
  "implementationFiles": [
    {
      "path": "packages/adapters/web/components/checkbox.mjs",
      "blobSha": "41a19cbff884b7e944a6bebcdae415dc0e5612ce"
    },
    {
      "path": "packages/adapters/web/components/checkbox.css",
      "blobSha": "5d2d21868a7bcb16e28391d1163694fdc40b1fbc"
    }
  ],
  "browserEvidence": {
    "runId": 34628397403,
    "artifactId": 10275107747
  },
  "deployment": {
    "repository": "neosmartui/neosmartui.github.io",
    "commitSha": "c9df7f2db1ba29467086473a63bc29a719885423",
    "treeSha": "d7e2086855177d58b1aa57c53a8e6fdb1136356c",
    "pagesRunId": 34628914517
  },
  "live": {
    "pageUrl": "https://neosmartui.github.io/",
    "deploymentRecordUrl": "https://neosmartui.github.io/deployment.json"
  }
}
