{"$schema":"../../spec/schemas/public-proof.schema.json","schema":"neosmartui/public-proof@1","flavor":"flavor.soft","deployedSource":{"repository":"neosmartui/neosmartui","sha":"21147fdd8b97e60635d1c7d635bb463e73a616cf"},"implementationFiles":[{"path":"packages/themes/soft-light/theme.json","blobSha":"ab7745b39f9cdc39f9f3e588421e119fec8134fd"},{"path":"packages/themes/soft-light/resolution.json","blobSha":"1528202d843d62d7a588a29f171c1afd1811931a"},{"path":"packages/themes/soft-light/tokens.json","blobSha":"8f83c5fc00d7f155ee4c2b0c2e18d415a5a0aaf8"},{"path":"apps/foundry/src/flavors/soft/index.html","blobSha":"d3cc29c9c83f3e847f1eca821ed94254e2a05a98"},{"path":"packages/themes/soft-dark/theme.json","blobSha":"ff55cbb4d39d0511b4703fe28d07dd09a8621f05"},{"path":"packages/themes/soft-dark/resolution.json","blobSha":"56e612eeb655480f90e0e1bf25fd23d490a9ef5b"},{"path":"packages/themes/soft-dark/tokens.json","blobSha":"16635c835caab850edaaefd05c78fd7c95aa3d73"},{"path":"apps/foundry/fragments/soft-dark.html","blobSha":"10bcf0d78c357e2eb458a9aaca5de90b6634b6c5"},{"path":"tooling/foundry/assemble-soft-dark.mjs","blobSha":"bc1aeadc885fdb89d041309841ef31ee8af2b809"}],"browserEvidence":{"runId":35424484846,"artifactId":10578957954},"deployment":{"repository":"neosmartui/neosmartui.github.io","commitSha":"064fad06fa09b351afec6f3bcba1b27829cb0356","treeSha":"76837242ee63237533244007878a9fbb062b75a0","pagesRunId":35457802950},"live":{"pageUrl":"https://neosmartui.github.io/flavors/soft/","deploymentRecordUrl":"https://neosmartui.github.io/deployment.json","assetUrls":["https://neosmartui.github.io/soft-theme.css","https://neosmartui.github.io/soft-dark-theme.css"]}}