{"$schema":"../../spec/schemas/public-proof.schema.json","schema":"neosmartui/public-proof@1","component":"core.combobox","deployedSource":{"repository":"neosmartui/neosmartui","sha":"fb2b401f67723f5274f1bd3699be97877fc88c86"},"implementationFiles":[{"path":"packages/adapters/web/components/combobox.mjs","blobSha":"7894c98f07a7e9c940d041e40fc016eab431d003"},{"path":"packages/adapters/web/components/combobox.css","blobSha":"5ad0e707fc613135384866c118c30872402ded71"}],"browserEvidence":{"runId":35249742761,"artifactId":10509631176},"deployment":{"repository":"neosmartui/neosmartui.github.io","commitSha":"4c576231efd8ff479f67e748001ff43914216a76","treeSha":"c037e76d9b288a081ad11dda17d12c2b432d9d1d","pagesRunId":35295432975},"live":{"pageUrl":"https://neosmartui.github.io/","deploymentRecordUrl":"https://neosmartui.github.io/deployment.json"}}