{"$schema":"../../spec/schemas/public-proof.schema.json","schema":"neosmartui/public-proof@1","component":"core.field","deployedSource":{"repository":"neosmartui/neosmartui","sha":"3c110fe3059d13a4030d1543948d8207faf380a9"},"implementationFiles":[{"path":"packages/adapters/web/components/field.css","blobSha":"c3d022e18a688e4a31d4225811ad6971719f6a70"}],"browserEvidence":{"runId":35300370653,"artifactId":10529716708},"deployment":{"repository":"neosmartui/neosmartui.github.io","commitSha":"ce4c1af21945205c31228b4064504b4d75cd68d5","treeSha":"16ba5ee884448faf1ff4ee1a1191df2b7f050ded","pagesRunId":35301098350},"live":{"pageUrl":"https://neosmartui.github.io/","deploymentRecordUrl":"https://neosmartui.github.io/deployment.json"}}