{
  "$schema": "../../spec/schemas/public-proof.schema.json",
  "schema": "neosmartui/public-proof@1",
  "component": "core.select",
  "deployedSource": {
    "repository": "neosmartui/neosmartui",
    "sha": "09d04bc7dc1a99c473b670a5d768c867d6da1a99"
  },
  "implementationFiles": [
    {
      "path": "packages/adapters/web/components/select.mjs",
      "blobSha": "c2bec8c681f13e9d480858eb148d6415a9330026"
    },
    {
      "path": "packages/adapters/web/components/select.css",
      "blobSha": "0f9c9fe5b3df0b80ab25e982811c5fd73195d77b"
    }
  ],
  "browserEvidence": {
    "runId": 34643302864,
    "artifactId": 10281090546
  },
  "deployment": {
    "repository": "neosmartui/neosmartui.github.io",
    "commitSha": "b35f3a26a61444979de7a04c9a5ff4d1db45df1e",
    "treeSha": "eca906e80ecd02bb16707b9b6f317a4474e760f8",
    "pagesRunId": 34643671713
  },
  "live": {
    "pageUrl": "https://neosmartui.github.io/",
    "deploymentRecordUrl": "https://neosmartui.github.io/deployment.json"
  }
}
