{"$schema":"../../spec/schemas/public-proof.schema.json","schema":"neosmartui/public-proof@1","flavor":"flavor.rivet","deployedSource":{"repository":"neosmartui/neosmartui","sha":"be730284fd0c040aa6ad3be8cde6cb52acb3309a"},"implementationFiles":[{"path":"packages/themes/rivet-light/theme.json","blobSha":"2c3019f80f009c5f8e9625a870cc18fbeff6648c"},{"path":"packages/themes/rivet-light/resolution.json","blobSha":"7dc06f6ecaaa00361ddd1e7783eeb5ddb77ae17f"},{"path":"packages/themes/rivet-light/tokens.json","blobSha":"aebf4fbdbb39f36510dc910823f4ed7f1d66e086"},{"path":"apps/foundry/src/flavors/rivet/index.html","blobSha":"a9ec5aeaccdb7072021caa0613041d52c6078488"},{"path":"packages/themes/rivet-dark/theme.json","blobSha":"0b92947e78b285eb1a7a9747fec64940b47d2fcb"},{"path":"packages/themes/rivet-dark/resolution.json","blobSha":"e21466c1966a88b6fded8b10ea2af25412a0cc8c"},{"path":"packages/themes/rivet-dark/tokens.json","blobSha":"bf47c12d77fca90fb82753c9b96954034d5ae996"},{"path":"apps/foundry/fragments/rivet-dark.html","blobSha":"b1c8b136d71eb246486fc9023bb106cf59d27c8c"},{"path":"tooling/foundry/assemble-rivet-dark.mjs","blobSha":"e4d1f3d56631272979d368df271b13341dfbb823"}],"browserEvidence":{"runId":34737889119,"artifactId":10314159095},"deployment":{"repository":"neosmartui/neosmartui.github.io","commitSha":"ef84508f5dc001b72ebec3fdb7b3deb815c29454","treeSha":"f8d0282852ee376c4fbf96117d0439e9b960e031","pagesRunId":34747673153},"live":{"pageUrl":"https://neosmartui.github.io/flavors/rivet/","deploymentRecordUrl":"https://neosmartui.github.io/deployment.json","assetUrls":["https://neosmartui.github.io/rivet-theme.css","https://neosmartui.github.io/rivet-dark-theme.css"]}}
