{
  "$schema": "../../spec/schemas/public-proof.schema.json",
  "schema": "neosmartui/public-proof@1",
  "component": "core.button",
  "deployedSource": {
    "repository": "neosmartui/neosmartui",
    "sha": "09d04bc7dc1a99c473b670a5d768c867d6da1a99"
  },
  "implementationFiles": [
    {
      "path": "packages/adapters/web/components/button.mjs",
      "blobSha": "03136809d3518d4f2051b793c64ae247325c203d"
    },
    {
      "path": "packages/adapters/web/components/button.css",
      "blobSha": "821c70154173a536de3ff8b1eeb08f8cdeec1303"
    }
  ],
  "browserEvidence": {
    "runId": 34643302864,
    "artifactId": 10281090546
  },
  "deployment": {
    "repository": "neosmartui/neosmartui.github.io",
    "commitSha": "b35f3a26a61444979de7a04c9a5ff4d1db45df1e",
    "treeSha": "eca906e80ecd02bb16707b9b6f317a4474e760f8",
    "pagesRunId": 34643671713
  },
  "live": {
    "pageUrl": "https://neosmartui.github.io/",
    "deploymentRecordUrl": "https://neosmartui.github.io/deployment.json"
  }
}
