{
  "$schema": "../../spec/schemas/public-proof.schema.json",
  "schema": "neosmartui/public-proof@1",
  "component": "core.radio",
  "deployedSource": {
    "repository": "neosmartui/neosmartui",
    "sha": "ad87f50b24774a5e676ffc05ae62379c7be0576d"
  },
  "implementationFiles": [
    {
      "path": "packages/adapters/web/components/radio.mjs",
      "blobSha": "f34062fbb606b5677e3f98a3e8f0e2eafaeb1d95"
    },
    {
      "path": "packages/adapters/web/components/radio.css",
      "blobSha": "e537f101a4a624fa27ad0c06d642e6c8b56a4311"
    }
  ],
  "browserEvidence": {
    "runId": 34704509621,
    "artifactId": 10300792653
  },
  "deployment": {
    "repository": "neosmartui/neosmartui.github.io",
    "commitSha": "fbc70d0455be94479f652bf7f27481c7647bf198",
    "treeSha": "b83a0c1eaff598a7e88cd3af103c73f9717d34aa",
    "pagesRunId": 34704772239
  },
  "live": {
    "pageUrl": "https://neosmartui.github.io/",
    "deploymentRecordUrl": "https://neosmartui.github.io/deployment.json"
  }
}
