{
  "$schema": "../../spec/schemas/public-proof.schema.json",
  "schema": "neosmartui/public-proof@1",
  "component": "core.tooltip",
  "deployedSource": {
    "repository": "neosmartui/neosmartui",
    "sha": "ad87f50b24774a5e676ffc05ae62379c7be0576d"
  },
  "implementationFiles": [
    {
      "path": "packages/adapters/web/components/tooltip.mjs",
      "blobSha": "9b62475c9c6a8d13c444b41281d2ccd6d7709a57"
    },
    {
      "path": "packages/adapters/web/components/tooltip.css",
      "blobSha": "ece38916d39ddd588295b057e051b20e52ad0f97"
    }
  ],
  "browserEvidence": {
    "runId": 34704509621,
    "artifactId": 10300792653
  },
  "deployment": {
    "repository": "neosmartui/neosmartui.github.io",
    "commitSha": "fbc70d0455be94479f652bf7f27481c7647bf198",
    "treeSha": "b83a0c1eaff598a7e88cd3af103c73f9717d34aa",
    "pagesRunId": 34704772239
  },
  "live": {
    "pageUrl": "https://neosmartui.github.io/",
    "deploymentRecordUrl": "https://neosmartui.github.io/deployment.json"
  }
}
