{
  "$schema": "../../spec/schemas/public-proof.schema.json",
  "schema": "neosmartui/public-proof@1",
  "component": "core.badge",
  "deployedSource": {
    "repository": "neosmartui/neosmartui",
    "sha": "f4fdf3fbf3924b1598e1ee5be4dda22edcbf73e6"
  },
  "implementationFiles": [
    {
      "path": "packages/adapters/web/components/badge.css",
      "blobSha": "199f963cb712828c42e9b1ea9432e69feb02c001"
    }
  ],
  "browserEvidence": {
    "runId": 34677415919,
    "artifactId": 10292104339
  },
  "deployment": {
    "repository": "neosmartui/neosmartui.github.io",
    "commitSha": "bbd5696b4b0e24ab1fd4d5c8c0b6e462608667fa",
    "treeSha": "dd1bdf23838ffe5f79d6085b0d0544f5f03adff4",
    "pagesRunId": 34678037957
  },
  "live": {
    "pageUrl": "https://neosmartui.github.io/",
    "deploymentRecordUrl": "https://neosmartui.github.io/deployment.json"
  }
}
