{"$schema":"../../spec/schemas/public-proof.schema.json","schema":"neosmartui/public-proof@1","flavor":"flavor.mono","deployedSource":{"repository":"neosmartui/neosmartui","sha":"75fe02594bf1395275f1b4c611bcb4b1d8b1999c"},"implementationFiles":[{"path":"packages/themes/mono-light/theme.json","blobSha":"1a359b3e85656c49603031ed45ef01e28d46fb5f"},{"path":"packages/themes/mono-light/resolution.json","blobSha":"68f3a2bccff9e2e57575dca4b0cd9592c33e0964"},{"path":"packages/themes/mono-light/tokens.json","blobSha":"6e213c2b2cfe1a7df663e286dc62ca079a42be7f"},{"path":"apps/foundry/src/flavors/mono/index.html","blobSha":"d45af00591c556af94e04626bb0b1fefadd4ae93"}],"browserEvidence":{"runId":34713187736,"artifactId":10304495336},"deployment":{"repository":"neosmartui/neosmartui.github.io","commitSha":"c493bb58fcae679c16bf374775be1523ed50a28c","treeSha":"6423aef0f9b9be2088812143925b4a97c852c101","pagesRunId":34713466334},"live":{"pageUrl":"https://neosmartui.github.io/flavors/mono/","deploymentRecordUrl":"https://neosmartui.github.io/deployment.json","assetUrls":["https://neosmartui.github.io/mono-theme.css"]}}
