{"$schema":"../../spec/schemas/public-proof.schema.json","schema":"neosmartui/public-proof@1","component":"core.input","deployedSource":{"repository":"neosmartui/neosmartui","sha":"fb2b401f67723f5274f1bd3699be97877fc88c86"},"implementationFiles":[{"path":"packages/adapters/web/components/input.mjs","blobSha":"e148fa89218ef628f989c138a250db3af77c6f40"},{"path":"packages/adapters/web/components/input.css","blobSha":"9eda0543ec5ea3bf1a917a175f30ea6900328b50"}],"browserEvidence":{"runId":35249742761,"artifactId":10509631176},"deployment":{"repository":"neosmartui/neosmartui.github.io","commitSha":"4c576231efd8ff479f67e748001ff43914216a76","treeSha":"c037e76d9b288a081ad11dda17d12c2b432d9d1d","pagesRunId":35295432975},"live":{"pageUrl":"https://neosmartui.github.io/","deploymentRecordUrl":"https://neosmartui.github.io/deployment.json"}}