{
  "$schema": "../../spec/schemas/public-proof.schema.json",
  "schema": "neosmartui/public-proof@1",
  "component": "core.textarea",
  "deployedSource": {
    "repository": "neosmartui/neosmartui",
    "sha": "57dc766ece8eca13b8c60b6f14615692ecdb51e8"
  },
  "implementationFiles": [
    {
      "path": "packages/adapters/web/components/textarea.mjs",
      "blobSha": "139a1ed4679b40e76136114df87daa8e15db34de"
    },
    {
      "path": "packages/adapters/web/components/textarea.css",
      "blobSha": "7015337f7f1fdba65e53abcedb99fadb42e4d77a"
    }
  ],
  "browserEvidence": {
    "runId": 34699170996,
    "artifactId": 10300390087
  },
  "deployment": {
    "repository": "neosmartui/neosmartui.github.io",
    "commitSha": "f5caac25c16aa012222edeeb3b0e85c6b1bfbd11",
    "treeSha": "b0f9ec75170566945b8bf00af9a5c8b1b3136555",
    "pagesRunId": 34700103133
  },
  "live": {
    "pageUrl": "https://neosmartui.github.io/",
    "deploymentRecordUrl": "https://neosmartui.github.io/deployment.json"
  }
}
