{
  "$schema": "../../spec/schemas/public-proof.schema.json",
  "schema": "neosmartui/public-proof@1",
  "component": "core.segmented-control",
  "deployedSource": {
    "repository": "neosmartui/neosmartui",
    "sha": "8508ffd2910ecc32cc6e45e10ff1197b0187e33c"
  },
  "implementationFiles": [
    {
      "path": "packages/adapters/web/components/segmented-control.mjs",
      "blobSha": "513e24822b7e6612ca77706b02c26208b2155103"
    },
    {
      "path": "packages/adapters/web/components/segmented-control.css",
      "blobSha": "b1f99072569be9b4a093e56ac29e9234454855ee"
    }
  ],
  "browserEvidence": {
    "runId": 34668050460,
    "artifactId": 10290170049
  },
  "deployment": {
    "repository": "neosmartui/neosmartui.github.io",
    "commitSha": "9a498c52628306dd46565ca478b2f9059088c91f",
    "treeSha": "d581827d86ebfbc6f1c21949c0b0a4f40430cd37",
    "pagesRunId": 34668426196
  },
  "live": {
    "pageUrl": "https://neosmartui.github.io/",
    "deploymentRecordUrl": "https://neosmartui.github.io/deployment.json"
  }
}
