{
  "$schema": "../../spec/schemas/public-proof.schema.json",
  "schema": "neosmartui/public-proof@1",
  "component": "core.switch",
  "deployedSource": {
    "repository": "neosmartui/neosmartui",
    "sha": "026250b5f2400777ef2701b80990b1e9d6d0b938"
  },
  "implementationFiles": [
    {
      "path": "packages/adapters/web/components/switch.mjs",
      "blobSha": "476873e8b125d570c0147e3c8dd1390fd8ed5bb8"
    },
    {
      "path": "packages/adapters/web/components/switch.css",
      "blobSha": "25ea10e1a84d4ebca2f79d36f4bd6bf4d857c663"
    }
  ],
  "browserEvidence": {
    "runId": 34628397403,
    "artifactId": 10275107747
  },
  "deployment": {
    "repository": "neosmartui/neosmartui.github.io",
    "commitSha": "c9df7f2db1ba29467086473a63bc29a719885423",
    "treeSha": "d7e2086855177d58b1aa57c53a8e6fdb1136356c",
    "pagesRunId": 34628914517
  },
  "live": {
    "pageUrl": "https://neosmartui.github.io/",
    "deploymentRecordUrl": "https://neosmartui.github.io/deployment.json"
  }
}
