{"$schema":"../../spec/schemas/public-proof.schema.json","schema":"neosmartui/public-proof@1","component":"core.card","deployedSource":{"repository":"neosmartui/neosmartui","sha":"be730284fd0c040aa6ad3be8cde6cb52acb3309a"},"implementationFiles":[{"path":"packages/adapters/web/components/card.css","blobSha":"0f851c0eeb60dbbc06fa44f66e30a7fa50b8692c"}],"browserEvidence":{"runId":34737889119,"artifactId":10314159095},"deployment":{"repository":"neosmartui/neosmartui.github.io","commitSha":"ef84508f5dc001b72ebec3fdb7b3deb815c29454","treeSha":"f8d0282852ee376c4fbf96117d0439e9b960e031","pagesRunId":34747673153},"live":{"pageUrl":"https://neosmartui.github.io/","deploymentRecordUrl":"https://neosmartui.github.io/deployment.json"}}
