{"$schema":"../../spec/schemas/public-proof.schema.json","schema":"neosmartui/public-proof@1","component":"core.accordion","deployedSource":{"repository":"neosmartui/neosmartui","sha":"9135d2b00b34954f41c72f4b6c12289d10b476fc"},"implementationFiles":[{"path":"packages/adapters/web/components/accordion.mjs","blobSha":"f81715844ed9c180279ad9a9257ccb9956cb7fd6"},{"path":"packages/adapters/web/components/accordion.css","blobSha":"e0d494ff63973bd39d6815583f643e01b394ffe1"}],"browserEvidence":{"runId":34716720270,"artifactId":10305015410},"deployment":{"repository":"neosmartui/neosmartui.github.io","commitSha":"f49bd9fc63a6cd91c0f078da1085d1bec39f4246","treeSha":"91e35ce23eab8e1b1a97456e39255c98706aacde","pagesRunId":34717457307},"live":{"pageUrl":"https://neosmartui.github.io/","deploymentRecordUrl":"https://neosmartui.github.io/deployment.json"}}
