{
  "$schema": "../../spec/schemas/public-proof.schema.json",
  "schema": "neosmartui/public-proof@1",
  "component": "core.tabs",
  "deployedSource": {
    "repository": "neosmartui/neosmartui",
    "sha": "5e999f2e62dc7727ebb74a9c79c5bd40513d6d0d"
  },
  "implementationFiles": [
    {
      "path": "packages/adapters/web/components/tabs.mjs",
      "blobSha": "1c76261adbd4d5768cb9ba7fd4977ff224714ea1"
    },
    {
      "path": "packages/adapters/web/components/tabs.css",
      "blobSha": "af66b4901193ed49512cac34211d60bc8c10b4f4"
    }
  ],
  "browserEvidence": {
    "runId": 34707268277,
    "artifactId": 10301797631
  },
  "deployment": {
    "repository": "neosmartui/neosmartui.github.io",
    "commitSha": "ff7723951ff1eba3a6890ce57f71eeb2646f524a",
    "treeSha": "24f8086b988db5aaa97c6bba44c4f8f35dcf6c95",
    "pagesRunId": 34707560564
  },
  "live": {
    "pageUrl": "https://neosmartui.github.io/",
    "deploymentRecordUrl": "https://neosmartui.github.io/deployment.json"
  }
}
